{
  "$schema": "../../schema-json/dock.schema.json",
  "id": "dock.crossroads_hub",
  "portId": "port.crossroads_hub",
  "name": "Crossroads Hub, Bay 14",
  "palette": {
    "floor": "#3a4150",
    "wall": "#1d222c",
    "accent": "#f2a93b"
  },
  "width": 40,
  "height": 29,
  "rows": [
    "########################################",
    "                                        ",
    "                                        ",
    "                                        ",
    "                                        ",
    "                                        ",
    "                                        ",
    "                                        ",
    "                                        ",
    "                                        ",
    "                                        ",
    "                                        ",
    "                                        ",
    "                                        ",
    "                                        ",
    "                                        ",
    "                                        ",
    "                                        ",
    "                                        ",
    "                                        ",
    "                                        ",
    "........................................",
    "........................................",
    "........................................",
    "........................................",
    "........................................",
    "........................................",
    "........#..................#............",
    "########################################"
  ],
  "legend": {
    ".": "floor",
    "#": "wall",
    " ": "void"
  },
  "berth": {
    "origin": {
      "x": 2,
      "y": 1
    },
    "sizeClass": "M"
  },
  "posts": [
    {
      "key": "queue_kiosk",
      "kind": "kiosk",
      "name": "the queue-board kiosk",
      "tile": {
        "x": 31,
        "y": 23
      },
      "facing": "n"
    },
    {
      "key": "night_stall",
      "kind": "marketStall",
      "name": "the night-market stall",
      "tile": {
        "x": 1,
        "y": 25
      },
      "facing": "e"
    },
    {
      "key": "lounge_gate",
      "kind": "gate",
      "name": "the transit lounge gate",
      "tile": {
        "x": 35,
        "y": 27
      },
      "facing": "n"
    },
    {
      "key": "dispatch",
      "kind": "warehouseDoor",
      "name": "the Co-op dispatch window",
      "tile": {
        "x": 12,
        "y": 27
      },
      "facing": "n"
    },
    {
      "key": "bench",
      "kind": "bench",
      "name": "the bench by the lounge gate",
      "tile": {
        "x": 32,
        "y": 27
      },
      "facing": "n"
    }
  ],
  "areas": [
    {
      "key": "staging",
      "kind": "freightStaging",
      "rect": {
        "x": 18,
        "y": 23,
        "w": 4,
        "h": 3
      }
    },
    {
      "key": "delivery",
      "kind": "deliveryBay",
      "rect": {
        "x": 10,
        "y": 24,
        "w": 4,
        "h": 3
      }
    }
  ],
  "props": [
    {
      "key": "crates_aft",
      "kind": "crates",
      "rect": {
        "x": 4,
        "y": 22,
        "w": 3,
        "h": 2
      },
      "rot": 0,
      "blocking": true
    },
    {
      "key": "crates_corner",
      "kind": "crates",
      "rect": {
        "x": 37,
        "y": 23,
        "w": 2,
        "h": 2
      },
      "rot": 90,
      "blocking": true
    },
    {
      "key": "container_aft",
      "kind": "container",
      "rect": {
        "x": 4,
        "y": 26,
        "w": 2,
        "h": 1
      },
      "rot": 0,
      "blocking": true
    },
    {
      "key": "drums",
      "kind": "barrels",
      "rect": {
        "x": 25,
        "y": 25,
        "w": 2,
        "h": 1
      },
      "rot": 0,
      "blocking": true
    },
    {
      "key": "bollard_fore",
      "kind": "bollard",
      "rect": {
        "x": 39,
        "y": 21,
        "w": 1,
        "h": 1
      },
      "rot": 0,
      "blocking": true
    },
    {
      "key": "bollard_aft",
      "kind": "bollard",
      "rect": {
        "x": 0,
        "y": 21,
        "w": 1,
        "h": 1
      },
      "rot": 0,
      "blocking": true
    },
    {
      "key": "lamp_stall",
      "kind": "lamp",
      "rect": {
        "x": 0,
        "y": 27,
        "w": 1,
        "h": 1
      },
      "rot": 0,
      "blocking": true
    }
  ],
  "foreground": [
    {
      "kind": "bayWall",
      "rect": {
        "x": 0,
        "y": 0,
        "w": 40,
        "h": 1
      }
    },
    {
      "kind": "gantry",
      "rect": {
        "x": 12,
        "y": 0,
        "w": 1,
        "h": 21
      }
    },
    {
      "kind": "gantry",
      "rect": {
        "x": 28,
        "y": 0,
        "w": 1,
        "h": 21
      }
    },
    {
      "kind": "terminalEdge",
      "rect": {
        "x": 0,
        "y": 28,
        "w": 40,
        "h": 1
      }
    }
  ],
  "ambience": "Announcements every ninety seconds, the queue board flickering amber over the ramps, and somebody else's freight stacked wherever it fits."
}
